Disease,Remedy,Why,How
Flu,Rest,Rest is crucial as it helps your body fight off the infection and recover faster.,Ensure you get plenty of sleep and avoid strenuous activities. Stay in bed if possible.
Flu,Stay Hydrated,Flu can cause dehydration due to fever and sweating.,"Drink plenty of fluids such as water, herbal teas, and clear broths. Avoid caffeine and alcohol as they can dehydrate you."
Flu,Warm Fluids,Warm liquids can soothe a sore throat and help with congestion.,"Drink warm broths, herbal teas with honey, and warm lemon water."
Flu,Humidify the Air,Dry air can irritate your throat and nasal passages.,"Use a humidifier in your room. If you don’t have one, sitting in a steamy bathroom can also help."
Flu,Honey,Honey has natural antiviral and antimicrobial properties.,Add a teaspoon of honey to your tea or warm water. Avoid giving honey to children under one year old due to the risk of botulism.
Flu,Saltwater Gargle,Gargling with saltwater can soothe a sore throat.,Mix 1/4 to 1/2 teaspoon of salt in an 8-ounce glass of warm water and gargle several times a day.
Flu,Elderberry,Elderberry is believed to have antiviral properties and may reduce the severity and duration of flu symptoms.,"Elderberry syrups, lozenges, and teas are available over the counter."
Flu,Ginger,Ginger has anti-inflammatory properties and can help soothe a sore throat and nausea.,Add fresh ginger slices to hot water to make ginger tea. You can also add ginger to your food.
Flu,Chicken Soup,"Chicken soup is not just comforting, it also has anti-inflammatory properties and helps clear nasal congestion.",Make a homemade chicken soup with vegetables and broth.
Flu,Vitamin C,Vitamin C can boost your immune system.,"Increase your intake of vitamin C-rich foods like oranges, grapefruits, strawberries, bell peppers, and leafy greens. You can also take vitamin C supplements."
Flu,Probiotics,Probiotics can support your immune system.,"Consume probiotic-rich foods like yogurt, kefir, sauerkraut, and kimchi."
Flu,Peppermint,"Peppermint has menthol, which acts as a natural decongestant.",Drink peppermint tea or inhale peppermint steam.
Asthma,Control Your Environment,Reduce exposure to asthma triggers such as allergens and irritants.,"Use air purifiers, keep your home clean, and avoid smoking or being around smoke."
Asthma,Stay Hydrated,Staying hydrated can help keep your airways moist.,Drink plenty of water throughout the day.
Asthma,Breathing Exercises,Breathing exercises can help manage asthma symptoms and improve lung function.,Practice diaphragmatic breathing or pursed-lip breathing exercises.
Asthma,Hot Beverages,Hot beverages can help open up the airways and provide relief.,Drink hot herbal teas or just hot water.
Asthma,Ginger,Ginger has anti-inflammatory properties and can help relax the airways.,Add fresh ginger to your meals or make ginger tea by steeping ginger slices in hot water.
Asthma,Coffee,Caffeine in coffee can help open up the airways and improve breathing temporarily.,Drink a cup of strong coffee when you experience mild symptoms.
Asthma,Omega-3 Fatty Acids,Omega-3 fatty acids have anti-inflammatory properties that can help reduce asthma symptoms.,"Include omega-3-rich foods like fish, flaxseeds, and walnuts in your diet."
Asthma,Turmeric,Turmeric has anti-inflammatory properties that can help with asthma symptoms.,Add turmeric to your meals or drink turmeric milk.
Asthma,Magnesium-Rich Foods,Magnesium helps to relax the bronchial muscles and reduce symptoms.,"Eat magnesium-rich foods such as spinach, pumpkin seeds, and dark chocolate."
Asthma,Maintain Healthy Weight,Being overweight can worsen asthma symptoms. Maintaining a healthy weight can help improve symptoms.,Follow a balanced diet and engage in regular physical activity.
Sinusitis,Steam Inhalation,Steam inhalation can help relieve sinus congestion and ease breathing.,Inhale steam from a bowl of hot water or take a hot shower.
Sinusitis,Nasal Irrigation,Nasal irrigation can help flush out mucus and allergens from the nasal passages.,Use a saline solution or a neti pot to rinse your nasal passages.
Sinusitis,Hydration,Staying hydrated can help thin mucus and alleviate sinus pressure.,Drink plenty of water throughout the day.
Sinusitis,Hot Compress,Applying a warm compress can help reduce sinus pain and inflammation.,"Place a warm, damp cloth over your face and sinuses for a few minutes."
Sinusitis,Rest,Resting can help your body fight off the infection and promote healing.,Take it easy and get plenty of rest to allow your body to recover.
Sinusitis,Spicy Foods,Spicy foods can help clear sinus congestion and promote drainage.,"Add spicy ingredients like chili peppers, horseradish, or garlic to your meals."
Sinusitis,Apple Cider Vinegar,Apple cider vinegar has antimicrobial properties and can help clear nasal congestion.,Mix one tablespoon of apple cider vinegar with a glass of warm water and drink it.
Sinusitis,Elevate Your Head,Sleeping with your head elevated can help drain your sinuses.,Use extra pillows to prop up your head while sleeping.
Sinusitis,Peppermint Oil,Peppermint oil has menthol that can help relieve sinus congestion and headache.,"Inhale peppermint oil vapors or apply diluted peppermint oil
Migraine,Rest,Resting in a quiet"
Migraine,Hydration,Dehydration can trigger migraines. Staying hydrated can help alleviate symptoms.,"Drink plenty of water throughout the day, and avoid caffeine and alcohol, which can dehydrate you."
Migraine,Apply Cold Compress,Applying a cold compress or ice pack to the painful area can help numb the pain and constrict blood vessels.,Wrap a few ice cubes in a cloth and apply it to your forehead or the back of your neck for 15-20 minutes.
Migraine,Massage,Massaging tense muscles can help relax them and alleviate migraine pain.,"Gently massage your temples, neck, and shoulders in a circular motion with your fingers."
Migraine,Acupressure,Acupressure may help relieve migraine pain by stimulating specific pressure points on the body.,Apply firm pressure to the LI4 point between your thumb and index finger for 5-10 minutes.
Migraine,Aromatherapy,Certain essential oils may help reduce migraine symptoms and promote relaxation.,"Inhale lavender, peppermint, or chamomile essential oils, or dilute them with a carrier oil and apply to your temples or wrists."
Migraine,Herbal Teas,Some herbal teas may have calming and pain-relieving properties that can help alleviate migraine symptoms.,"Drink teas made from ginger, peppermint, chamomile, or feverfew."
Migraine,Stay Consistent with Meals,"Skipping meals or fasting can trigger migraines in some people. Eating regular, balanced meals can help prevent migraines.","Eat meals and snacks at consistent times, and avoid skipping meals or fasting."
Migraine,Manage Stress,Stress can trigger migraines or make them worse. Managing stress through relaxation techniques or counseling may help reduce migraine frequency and severity.,"Practice deep breathing exercises, yoga, meditation, or progressive muscle relaxation."
Migraine,Regular Exercise,Regular physical activity can help reduce the frequency and severity of migraines by improving circulation and reducing stress.,"Engage in aerobic exercise, such as walking, swimming, or cycling, for at least 30 minutes most days of the week."
Migraine,Sleep Hygiene,Poor sleep habits or lack of sleep can trigger migraines. Establishing a regular sleep schedule and practicing good sleep hygiene can help prevent migraines.,"Go to bed and wake up at the same time every day, avoid caffeine and electronics before bedtime, and create a comfortable sleep environment."
Common Cold,Stay Hydrated,Staying hydrated can help loosen congestion and prevent dehydration.,"Drink plenty of water, herbal teas, clear broths, and electrolyte-rich drinks like coconut water."
Common Cold,Rest,Resting allows your body to focus its energy on fighting off the virus and recovering.,Get plenty of sleep and avoid strenuous activities. Take naps throughout the day if needed.
Common Cold,Steam Inhalation,Inhaling steam can help loosen mucus and relieve nasal congestion.,Boil water and pour it into a bowl. Lean over the bowl with a towel covering your head and inhale the steam for 5-10 minutes.
Common Cold,Saltwater Gargle,Gargling with saltwater can help soothe a sore throat and reduce inflammation.,Mix 1/4 to 1/2 teaspoon of salt in a glass of warm water and gargle several times a day.
Common Cold,Honey and Lemon,"Honey has antimicrobial properties, while lemon provides vitamin C and antioxidants.",Mix honey and lemon juice in warm water or herbal tea and drink it to soothe a sore throat and boost immunity.
Common Cold,Chicken Soup,"Chicken soup can help relieve congestion, soothe a sore throat, and provide hydration and nourishment.",Enjoy homemade chicken soup with vegetables and broth. The warmth and steam can also help clear nasal passages.
Common Cold,Vitamin C,Vitamin C boosts the immune system and may reduce the duration and severity of cold symptoms.,"Increase your intake of vitamin C-rich foods like oranges, strawberries, kiwi, bell peppers, and broccoli."
Common Cold,Echinacea,Echinacea is an herb that may help shorten the duration of cold symptoms and boost immunity.,Take echinacea supplements or drink echinacea tea according to package instructions.
Common Cold,Hot Beverages,"Hot beverages like tea, herbal tea, or broth can help soothe a sore throat, relieve congestion, and keep you hydrated.",Drink hot beverages throughout the day to stay warm and comfortable.
Common Cold,Saline Nasal Spray,"Saline nasal sprays can help moisturize and clear nasal passages, reducing congestion and improving breathing.","Use saline nasal spray several times a day, especially before bed and upon waking up."
Common Cold,Steamy Shower,"Taking a steamy shower can help moisturize nasal passages, relieve congestion, and ease breathing.","Enjoy a steamy shower for 10-15 minutes, and breathe deeply to inhale the steam."
Pneumonia,Rest,Resting allows your body to focus on fighting the infection and promotes healing.,Get plenty of sleep and avoid strenuous activities. Listen to your body and take breaks as needed.
Pneumonia,Stay Hydrated,"Staying hydrated helps thin mucus, soothe a sore throat, and prevent dehydration.","Drink plenty of water, herbal teas, clear broths, and electrolyte-rich drinks like coconut water."
Pneumonia,Steam Inhalation,Inhaling steam can help loosen mucus and relieve congestion in the chest and nasal passages.,Boil water and pour it into a bowl. Lean over the bowl with a towel covering your head and inhale the steam for 5-10 minutes.
Pneumonia,Elevate Your Head,Sleeping with your head elevated can help ease breathing and reduce coughing at night.,Use extra pillows to prop up your head while sleeping to improve airflow.
Pneumonia,Healthy Diet,Eating a balanced diet rich in nutrients can support your immune system and promote recovery.,"Include plenty of fruits, vegetables, lean proteins, whole grains, and healthy fats in your meals."
Pneumonia,Proper Ventilation,Good indoor air quality is important for respiratory health. Proper ventilation can help reduce the risk of respiratory infections.,Open windows for fresh air circulation and use exhaust fans to remove indoor pollutants.
Pneumonia,Avoid Smoking,"Smoking damages the lungs and weakens the immune system, making it harder to fight off infections like pneumonia.",Avoid smoking and exposure to secondhand smoke. Seek support to quit smoking if needed.
Pneumonia,Medication,Antibiotics or antiviral medications may be prescribed by a healthcare professional to treat bacterial or viral pneumonia.,Take prescribed medications as directed by your doctor and complete the full course of treatment.
Pneumonia,Monitor Symptoms,"Regularly monitor your symptoms and seek medical attention if they worsen or if you experience difficulty breathing, chest pain, high fever, or confusion.","Keep track of your temperature, cough, and overall well-being. Contact your healthcare provider if you have concerns."
Pneumonia,Physical Activity,"Light physical activity, such as gentle stretching or walking, can help improve circulation and lung function while promoting overall well-being.","Engage in light activities as tolerated, but avoid strenuous exercise until you've fully recovered."
Pneumonia,Seek Medical Care,"Pneumonia can be serious, especially for certain high-risk groups. Seek prompt medical attention if you suspect you have pneumonia or if symptoms persist despite home remedies.",Contact your healthcare provider or go to the nearest emergency room if you experience severe symptoms or if you have a pre-existing condition that puts you at higher risk.
Allergies,Identify Triggers,Identifying and avoiding allergens can help prevent allergy symptoms.,"Keep track of when and where you experience symptoms, and try to pinpoint potential triggers such as pollen, pet dander, dust mites, or certain foods."
Allergies,Limit Exposure,Reducing exposure to allergens can minimize allergic reactions.,"Stay indoors on high pollen days, use air purifiers to remove allergens from indoor air, and keep windows closed during peak pollen seasons."
Allergies,Nasal Irrigation,"Nasal irrigation can help flush out allergens and mucus from the nasal passages, providing relief from congestion and sinus pressure.",Use a saline solution or a neti pot to rinse your nasal passages. Follow proper instructions for safe nasal irrigation.
Allergies,Allergy-Proof Your Home,Taking steps to allergy-proof your home can create a more allergen-free environment.,"Regularly clean and vacuum your home, wash bedding in hot water to remove dust mites, and consider using allergen-proof covers on pillows and mattresses."
Allergies,Shower After Being Outdoors,"Showering after spending time outdoors can remove pollen and allergens from your skin and hair, reducing the risk of allergic reactions.","Take a shower and change clothes after outdoor activities, especially during high pollen seasons."
Allergies,Use HEPA Filters,"High-efficiency particulate air (HEPA) filters can capture airborne allergens and improve indoor air quality, reducing allergy symptoms.","Use HEPA filters in vacuum cleaners, air purifiers, and HVAC systems to trap allergens."
Allergies,Over-the-Counter Medications,"Over-the-counter allergy medications such as antihistamines, decongestants, and nasal sprays can help relieve allergy symptoms like sneezing, itching, and congestion.",Follow the instructions on the packaging and consult with a healthcare professional if you have questions or concerns about medication use.
Allergies,Allergy Shots (Immunotherapy),"Allergy shots, also known as immunotherapy, can help desensitize the immune system to specific allergens over time, reducing the severity of allergic reactions.",Consult with an allergist to determine if allergy shots are a suitable treatment option for you. These injections are administered regularly over a period of time.
Allergies,Herbal Remedies,"Certain herbal remedies like butterbur, stinging nettle, and quercetin may have antihistamine and anti-inflammatory properties that can help alleviate allergy symptoms.","Talk to your healthcare provider before using herbal remedies, as they may interact with other medications or have side effects."
Allergies,Eye Drops,"Over-the-counter or prescription eye drops can provide relief from itchy, red, and watery eyes caused by allergies.","Choose eye drops specifically formulated for allergies and follow the instructions for use. Avoid rubbing your eyes, as this can worsen symptoms."
Allergies,Stay Informed,"Stay informed about pollen counts, air quality, and allergy forecasts in your area to better manage your allergy symptoms.",Check local weather reports or use allergy tracking apps to monitor environmental conditions and plan outdoor activities accordingly.
COVID-19,Follow Public Health Guidelines,"Following public health guidelines such as wearing masks, practicing social distancing, and washing hands frequently can help prevent the spread of COVID-19.",Adhere to guidelines issued by local health authorities and governments to reduce the risk of contracting or spreading the virus.
COVID-19,Quarantine or Isolate,Quarantining or isolating if you have COVID-19 symptoms or have been exposed to the virus can help prevent further transmission to others.,"Stay home and avoid close contact with others, including household members, for the recommended duration of quarantine or isolation."
COVID-19,Seek Medical Advice,"Seek medical advice if you develop COVID-19 symptoms such as fever, cough, shortness of breath, fatigue, loss of taste or smell, or other symptoms consistent with the virus.","Contact your healthcare provider or local health department for guidance on testing, treatment, and self-care measures."
COVID-19,Monitor Symptoms,"Monitor your symptoms and seek medical attention if they worsen or become severe, especially if you have underlying health conditions or are at higher risk for complications.","Keep track of your symptoms, such as fever, cough, difficulty breathing, and fatigue. Seek prompt medical care if you experience emergency warning signs such as trouble breathing, persistent chest pain, confusion, bluish lips or face, or inability to wake up."
COVID-19,Rest and Hydration,Getting plenty of rest and staying hydrated can help support your immune system and promote recovery from COVID-19.,"Get adequate sleep, drink fluids such as water, herbal teas, and clear broths, and avoid excessive physical exertion to allow your body to rest and heal."
COVID-19,Eat a Balanced Diet,Eating a balanced diet rich in nutrients can help support your immune system and overall health during recovery from COVID-19.,"Include a variety of fruits, vegetables, lean proteins, whole grains, and healthy fats in your diet. Limit processed foods, sugary snacks, and excessive alcohol consumption."
COVID-19,Manage Stress,Managing stress and practicing self-care techniques can help improve mental and emotional well-being during challenging times.,"Engage in activities that help you relax and unwind, such as meditation, deep breathing exercises, yoga, or spending time in nature. Stay connected with friends and loved ones through virtual means."
COVID-19,Stay Informed,"Stay informed about COVID-19 updates, vaccination efforts, and public health recommendations from reputable sources such as the World Health Organization (WHO) and the Centers for Disease Control and Prevention (CDC).","Stay up to date on the latest information about COVID-19 transmission, prevention measures, vaccination eligibility, and local regulations."
COVID-19,Get Vaccinated,Getting vaccinated against COVID-19 can help protect yourself and others from the virus and its complications.,Follow vaccination guidelines and recommendations provided by health authorities. Schedule an appointment to receive the COVID-19 vaccine when eligible.
COVID-19,Practice Good Respiratory Hygiene,"Practicing good respiratory hygiene, such as covering your mouth and nose with a tissue or your elbow when coughing or sneezing, can help prevent the spread of respiratory droplets containing the virus.","Dispose of used tissues properly, wash your hands frequently with soap and water for at least 20 seconds, or use hand sanitizer with at least 60% alcohol content."
Tonsillitis,Rest,Resting allows your body to fight off the infection and promotes faster recovery.,Get plenty of sleep and avoid strenuous activities.
Tonsillitis,Stay Hydrated,Staying hydrated helps soothe the throat and prevents dehydration.,"Drink plenty of fluids such as water, herbal teas, and clear broths. Avoid caffeine and alcohol."
Tonsillitis,Soft Foods,Eating soft foods can ease swallowing and reduce throat irritation.,"Consume foods like soups, mashed potatoes, yogurt, applesauce, and smoothies."
Tonsillitis,Saltwater Gargle,Gargling with salt water can help reduce throat inflammation and kill bacteria.,Mix 1/4 to 1/2 teaspoon of salt in an 8-ounce glass of warm water and gargle several times a day.
Tonsillitis,Honey,Honey has antimicrobial properties and can soothe a sore throat.,Add a teaspoon of honey to herbal teas or warm water. Avoid giving honey to children under one year old.
Tonsillitis,Lozenges or Hard Candy,Lozenges or hard candy can provide temporary relief from throat pain and irritation.,Choose sugar-free options to prevent worsening of symptoms.
Tonsillitis,Steam Inhalation,Inhaling steam can help moisten the throat and ease congestion.,Lean over a bowl of hot water and cover your head with a towel to trap the steam. Breathe deeply for several minutes.
Tonsillitis,Over-the-Counter Pain Relievers,Over-the-counter pain relievers such as acetaminophen or ibuprofen can help reduce fever and relieve throat pain.,Follow the dosage instructions on the package and consult a healthcare professional if needed.
Tonsillitis,Avoid Irritants,"Avoid irritants such as tobacco smoke, air pollution, and strong fumes that can aggravate throat inflammation.",Stay away from smoke and minimize exposure to environmental pollutants.
Tonsillitis,Stay Warm and Moist,Keeping the air warm and moist can prevent throat dryness and discomfort.,"Use a humidifier in your room, especially during dry weather or in heated indoor environments."
Tonsillitis,Follow Antibiotic Treatment,"If tonsillitis is caused by bacterial infection and your healthcare provider prescribes antibiotics, take the full course of medication as directed.","Finish the entire course of antibiotics, even if you start feeling better before completing the treatment."
Diabetes,Healthy Diet,A healthy diet can help regulate blood sugar levels and manage weight.,"Focus on consuming a balanced diet rich in fruits, vegetables, whole grains, lean proteins, and healthy fats. Limit intake of processed foods, sugary snacks, and high-carbohydrate foods."
Diabetes,Regular Exercise,Regular physical activity can improve insulin sensitivity and help control blood sugar levels.,"Engage in at least 30 minutes of moderate-intensity exercise most days of the week. Choose activities you enjoy, such as walking, swimming, cycling, or dancing."
Diabetes,Weight Management,Maintaining a healthy weight can improve insulin sensitivity and reduce the risk of complications.,Aim to achieve and maintain a healthy body weight through a combination of healthy eating and regular exercise.
Diabetes,Stay Hydrated,"Staying hydrated is important for overall health and can help prevent dehydration, which can affect blood sugar levels.",Drink plenty of water throughout the day. Limit intake of sugary beverages and alcohol.
Diabetes,Monitor Blood Sugar Levels,"Regularly monitoring blood sugar levels can help you understand how your body responds to food, exercise, and medication.",Use a blood glucose meter to check your blood sugar levels as recommended by your healthcare provider. Keep a record of your readings and discuss them with your healthcare team.
Diabetes,Eat Smaller, Frequent Meals,"Eating smaller, frequent meals throughout the day can help stabilize blood sugar levels and prevent spikes and crashes."
Diabetes,Limit Carbohydrates,"Carbohydrates can raise blood sugar levels, so it's important to monitor and limit your intake.","Choose complex carbohydrates with a low glycemic index, such as whole grains, legumes, and non-starchy vegetables. Avoid or limit refined carbohydrates and sugary foods."
Diabetes,Include Fiber-Rich Foods,Fiber can slow down the absorption of sugar and help improve blood sugar control.,"Incorporate fiber-rich foods such as fruits, vegetables, whole grains, legumes, and nuts into your meals and snacks."
Diabetes,Manage Stress,"Stress can affect blood sugar levels, so it's important to find healthy ways to manage stress.","Practice relaxation techniques such as deep breathing, meditation, yoga, or tai chi. Engage in activities you enjoy and prioritize self-care."
Diabetes,Get Adequate Sleep,Poor sleep can disrupt blood sugar levels and insulin sensitivity.,Strive for seven to eight hours of quality sleep each night. Establish a consistent sleep schedule and create a relaxing bedtime routine.
Diabetes,Limit Alcohol Intake,Alcohol can affect blood sugar levels and interfere with medication.,"If you choose to drink alcohol, do so in moderation and with food. Be mindful of your blood sugar levels and monitor how alcohol affects you."
Diabetes,Quit Smoking,Smoking can increase the risk of complications and worsen insulin resistance.,"If you smoke, seek support to quit smoking. Talk to your healthcare provider about smoking cessation strategies and resources."
Malaria,Rest,Rest is essential for the body to recover from malaria and regain strength.,Ensure you get plenty of rest and avoid strenuous activities until your symptoms improve.
Malaria,Stay Hydrated,Malaria can cause dehydration due to fever and sweating.,"Drink plenty of fluids such as water, herbal teas, and oral rehydration solutions to stay hydrated and replace lost fluids."
Malaria,Quinine,Quinine is a traditional remedy for malaria and can help reduce fever and chills.,Consult with a healthcare provider before using quinine as it can have side effects and interactions with certain medications. Follow the recommended dosage.
Malaria,Artemisia Annua (Sweet Wormwood),"Artemisia annua contains artemisinin, a compound with antimalarial properties.","Consult with a healthcare provider before using artemisia annua as a remedy. It is available in various forms, including capsules, teas, and extracts."
