Disease,Remedy,Why,How
Malaria,Cinchona Bark,Cinchona bark contains quinine and other compounds with antimalarial properties.,Consult with a healthcare provider before using cinchona bark as a remedy. It can be brewed as a tea or taken in supplement form.
Malaria,Neem Leaves,Neem leaves have antimicrobial properties and may help fight malaria parasites.,Boil neem leaves in water to make a tea. Drink the neem tea to help alleviate malaria symptoms.
Malaria,Ginger,Ginger has anti-inflammatory and antioxidant properties that may help reduce fever and inflammation associated with malaria.,Drink ginger tea or chew on a small piece of fresh ginger root. You can also add ginger to your meals.
Malaria,Orange Juice,"Orange juice is rich in vitamin C, which can help boost the immune system and aid in recovery from malaria.",Drink fresh orange juice to replenish lost nutrients and support your body's natural defenses.
Malaria,Coconut Water,Coconut water is hydrating and contains electrolytes that can help prevent dehydration.,Drink coconut water to stay hydrated and replenish lost fluids. It can also help soothe nausea and vomiting.
Malaria,Proper Nutrition,Eating a nutritious diet can help support your immune system and promote recovery from malaria.,"Eat a balanced diet rich in fruits, vegetables, whole grains, lean proteins, and healthy fats. Avoid processed foods and sugary snacks."
